{"$schema":"https://json-schema.org/draft/2020-12/schema","$id":"agentpass.provider-operation.v1","type":"object","additionalProperties":false,"required":["version","kind","operation_id","organization_id","app_id","provider","operation","request_digest","idempotency_key","state","created_at"],"properties":{"version":{"const":1},"kind":{"const":"agentpass.provider-operation"},"operation_id":{"format":"uuid"},"organization_id":{"format":"uuid"},"app_id":{"format":"uuid"},"provider":{"type":"string"},"operation":{"type":"string"},"request_digest":{"pattern":"^[0-9a-f]{64}$"},"idempotency_key":{"type":"string","minLength":8,"maxLength":256},"state":{"enum":["pending","accepted","uncertain","failed","reconciled"]},"created_at":{"type":"string","pattern":"^\\d{4}-\\d{2}-\\d{2}T\\d{2}:\\d{2}:\\d{2}\\.\\d{3}Z$"}}}
