{"version":1,"kind":"agentpass.provider-operation","operation_id":"11111111-1111-4111-8111-111111111111","organization_id":"22222222-2222-4222-8222-222222222222","app_id":"33333333-3333-4333-8333-333333333333","provider":"cloudflare","operation":"deploy","request_digest":"aaaaaaaaaaaaaaaaaaaaaaaaaaaaaaaaaaaaaaaaaaaaaaaaaaaaaaaaaaaaaaaa","idempotency_key":"deploy-20260101","state":"pending","created_at":"2026-01-01T00:00:00.000Z"}
